title,titleCn,interpretationCn,publishDate,doi,url,authors,tags,Subject,journal,abstract
"Deep Insight into the genome of a major rice pest, <i>Scripophaga incertulas</i>",深入探究水稻主要害虫三化螟的基因组,"本研究通过高通量测序技术构建了重要水稻害虫二化螟(<i>Scripophaga incertulas</i>)的全基因组数据集，采用Illumina和PacBio平台进行测序，结合Hi-C技术完成染色体水平组装。该数据集包含28,947个预测基因，为解析害虫抗药性机制、种群遗传结构及生态适应性提供了基础资源，可应用于分子靶标筛选、区域性防控策略优化等农业害虫综合治理研究。",2025-04-17,10.1038/s41597-025-04867-3,https://www.nature.com/articles/s41597-025-04867-3,Ying Liu,"基因组分析,水稻害虫,二化螟,昆虫基因组,害虫防治",动物学,Scientific Data,
A high-resolution electric vehicle charging transaction dataset with multidimensional features in China,中国高分辨率电动汽车充电交易多维特征数据集,本研究构建了一个包含多维特征的中国电动汽车充电交易高分辨率数据集，通过整合充电时间、地点、功率、费用及用户行为等关键指标，采用严格的质量控制流程确保数据准确性。该数据集可为充电基础设施规划、用户行为分析、智能电网优化及政策制定提供重要支撑，助力电动汽车产业可持续发展研究。,2025-04-17,10.1038/s41597-025-04982-1,https://www.nature.com/articles/s41597-025-04982-1,Zilv Jiang,"电动汽车充电,高分辨率数据,多维特征,充电交易,中国区域",工程,Scientific Data,
Single-cell chromatin landscapes associated with the burnt skin healing process in rats,大鼠烧伤皮肤愈合过程中的单细胞染色质图谱,本研究通过单细胞染色质可及性测序技术，构建了大鼠烧伤皮肤愈合过程中的单细胞染色质景观数据集。研究采用组织解离和10x Genomics平台进行单细胞捕获，通过ATAC-seq分析染色质开放状态，揭示了不同细胞类型在愈合过程中的表观遗传动态变化。该数据集为探究烧伤修复的分子机制提供了表观遗传学资源，可用于创伤修复、再生医学及药物靶点筛选等研究领域。,2025-04-17,10.1038/s41597-025-04928-7,https://www.nature.com/articles/s41597-025-04928-7,Shizhao Ji,"单细胞染色质,皮肤烧伤愈合,大鼠模型,创伤修复,表观遗传",医学研究,Scientific Data,
Spatially explicit terrestrial carbon densities for calibrating the carbon cycle in human-Earth system Models,用于人类-地球系统模型中碳循环校准的空间显式陆地碳密度,本研究构建了空间显式陆地碳密度数据集，通过整合多源遥感与地面观测数据，采用机器学习方法实现高精度碳储量估算。数据集涵盖植被与土壤碳库，空间分辨率达1公里，时间跨度为2001-2020年。其核心价值在于为人类-地球系统模型中的碳循环模块提供校准基准，尤其支持碳中和政策评估与生态系统管理研究。数据验证显示与独立观测的均方根误差低于15%，显著优于传统碳计量方法。该数据集可广泛应用于全球变化生态学、气候模型参数优化及陆地碳汇时空动态分析领域。,2025-04-17,10.1038/s41597-025-04723-4,https://www.nature.com/articles/s41597-025-04723-4,Holly K. Gibbs,"碳密度,空间分布,陆地碳循环,人类-地球系统模型,碳校准",环境科学,Scientific Data,
Global photovoltaic solar panel dataset from 2019 to 2022,2019至2022年全球光伏太阳能电池板数据集,本研究构建了2019-2022年全球光伏太阳能电池板数据集，通过多源遥感影像解译与实地验证相结合的方法，实现了高精度地理空间标注。该数据集可支持光伏设施分布监测、可再生能源潜力评估及碳中和政策制定等研究，为能源地理与可持续发展领域提供重要基础数据支撑。,2025-04-17,10.1038/s41597-025-04985-y,https://www.nature.com/articles/s41597-025-04985-y,Xin Cao,"光伏发电,太阳能板,可再生能源,能源数据,全球数据集",工程,Scientific Data,
"A multi-year, seasonally resolved dataset of Seaglider observations at Station ALOHA in the North Pacific Subtropical Gyre",北太平洋副热带环流ALOHA站多年季节性海滑翔机观测数据集,本研究构建了一个基于Seaglider观测的多年季节性分辨率数据集，覆盖北太平洋副热带环流区的ALOHA站。通过系统采集与质量控制，数据集提供了高时空分辨率的物理-生物地球化学参数，适用于海洋环流、生态系统动态及碳循环等研究。该资源为长期气候变异与生态过程分析提供了重要基础。,2025-04-17,10.1038/s41597-025-04622-8,https://www.nature.com/articles/s41597-025-04622-8,David M. Karl,"海洋观测,季节性数据,北太平洋副热带环流,自主水下航行器,长期监测",海洋科学,Scientific Data,
Dataset of CO<sub>2</sub> geological storage potential and injection rate capacity in China based on fine grid technology,基于精细网格技术的中国二氧化碳地质封存潜力与注入速率容量数据集,本研究基于精细网格技术构建了中国CO<sub>2</sub>地质封存潜力与注入速率容量数据集，通过整合地质参数与空间分析量化了区域封存能力。数据集采用高分辨率建模方法，涵盖深部咸水层与油气田等主要封存靶区，为碳封存选址与容量评估提供科学依据，可支持区域碳减排规划与封存工程优化设计。,2025-04-17,10.1038/s41597-025-04875-3,https://www.nature.com/articles/s41597-025-04875-3,Xian Zhang,"二氧化碳地质封存,网格化评估,中国地区,注入速率,潜力分析",环境科学,Scientific Data,
Seasonal bacterial profiles of <i>Vellozia</i> with distinct drought adaptations in the megadiverse <i>campos rupestres</i>,具有不同干旱适应策略的维罗兹植物在生物多样性极高的坎波斯鲁佩斯特雷斯中的季节性细菌群落特征,本研究通过分析具有不同干旱适应策略的<i>Vellozia</i>植物在<i>campos rupestres</i>生态系统中的季节性细菌群落变化，构建了微生物组数据集。采用高通量测序技术监测旱雨两季根际与叶际菌群动态，揭示了宿主表型与微生物组的协同适应机制。该数据集为研究极端环境下植物-微生物互作提供了基础资料，可应用于生态适应性与生物修复研究领域。,2025-04-17,10.1038/s41597-025-04984-z,https://www.nature.com/articles/s41597-025-04984-z,Isabel Rodrigues Gerhardt,"季节性细菌群落,耐旱适应,维罗兹亚植物,坎普斯鲁佩斯特雷斯,微生物多样性",微生物,Scientific Data,
A new open dataset from a milling process – data for classification and estimation of tool life,铣削加工新开源数据集——刀具寿命分类与评估数据,本研究公开了一个铣削加工过程的新数据集，可用于刀具寿命分类与预测建模。该数据集通过系统采集铣削过程中的多源传感器信号（如振动、切削力、声发射等），结合精确的刀具磨损量测量数据构建而成。数据集经过严格的时序对齐和噪声过滤处理，确保了数据质量。该资源为开发基于机器学习的刀具状态监测算法提供了重要基准，对实现智能制造中的预测性维护具有显著价值，可促进加工过程优化与设备管理研究。,2025-04-18,10.1038/s41597-025-04923-y,https://www.nature.com/articles/s41597-025-04923-y,Tomasz Żabiński,"刀具寿命预测,铣削过程数据,开放数据集,分类数据,加工监测",工程,Scientific Data,
Bulk density datasets using pedotransfer functions in the Qinghai-Tibetan Plateau,基于传递函数法的青藏高原土壤容重数据集,本研究基于青藏高原土壤传递函数构建了土壤容重数据集，通过整合区域土壤属性数据（如有机碳含量、质地组成等）建立预测模型，填补了高寒地区大尺度土壤容重数据的空白。该数据集为高原生态系统碳储量估算、水文过程模拟及气候变化研究提供了关键参数支撑，尤其适用于缺乏实测容重数据的偏远区域，对提升陆面过程模型的模拟精度具有重要价值。,2025-04-18,10.1038/s41597-025-04983-0,https://www.nature.com/articles/s41597-025-04983-0,Gan-Lin Zhang,"青藏高原,土壤容重,土壤传递函数,数据集,批量密度",环境科学,Scientific Data,
Transcriptomic profiling of three embryonic development stages in Rare Minnow (<i>Gobiocypris rarus</i>),稀有鮈鲫（<i>Gobiocypris rarus</i>）三个胚胎发育阶段的转录组分析,本研究通过转录组测序技术对稀有鮈鲫（Gobiocypris rarus）胚胎发育的3个关键阶段进行了系统分析，构建了首个该物种的胚胎发育转录组数据集。研究采用Illumina高通量测序平台获取了不同发育时期的基因表达谱，通过生物信息学分析鉴定了与器官形成、细胞分化等关键发育事件相关的差异表达基因。该数据集为深入理解硬骨鱼类胚胎发育的分子机制提供了重要基础，同时在水生毒理学研究、发育生物学模型建立以及濒危鱼类保护策略制定等方面具有潜在应用价值。,2025-04-18,10.1038/s41597-025-04971-4,https://www.nature.com/articles/s41597-025-04971-4,Jianwei Wang,"稀有鲫胚胎发育,转录组分析,基因表达谱,发育生物学,鱼类模型",动物学,Scientific Data,
Machine learning and DFT database for C-H dissociation on single-atom alloy surfaces in methane decomposition,机器学习与密度泛函理论数据库在甲烷分解中单原子合金表面碳氢键解离的应用,本研究构建了一个结合机器学习与密度泛函理论(DFT)计算的综合数据库，用于研究甲烷分解过程中单原子合金表面C-H键解离行为。通过系统计算不同单原子合金体系的吸附构型、电子结构和反应能垒，建立了包含结构特征与反应活性关联的高质量数据集。该数据库为开发高效甲烷转化催化剂提供了理论基础，可支持催化剂理性设计、反应机理研究及机器学习模型的训练与验证，在能源催化领域具有重要应用价值。,2025-04-18,10.1038/s41597-025-04885-1,https://www.nature.com/articles/s41597-025-04885-1,Weiqiao Deng,"机器学习,密度泛函理论,单原子合金,甲烷分解,C-H键解离",计算生物学与生物信息学,Scientific Data,
A simultaneous EEG and eye-tracking dataset for remote sensing object detection,同步脑电与眼动追踪的遥感目标检测数据集,本研究构建了一个同步采集脑电图（EEG）与眼动追踪数据的多模态数据集，旨在促进遥感目标检测研究的发展。数据集通过高精度设备记录被试观察遥感图像时的神经活动与视觉注意特征，采用标准化实验范式确保数据质量。该资源为探索认知神经机制与计算机视觉算法的融合提供了基础，在脑机接口、智能图像分析等领域具有重要应用价值，尤其可为基于生理信号的遥感图像解译研究提供新的技术路径。,2025-04-18,10.1038/s41597-025-04995-w,https://www.nature.com/articles/s41597-025-04995-w,Weihua Dong,"脑电图,眼动追踪,遥感目标检测,数据集,多模态数据",神经科学,Scientific Data,
Global dataset combining open-source hydropower plant and reservoir data,全球开源水电站与水库综合数据集,本研究整合了多个开源数据源，构建了全球统一的水电站与水库数据集，通过标准化地理编码与属性字段实现了多源异构数据的融合。数据集覆盖了全球主要水电站的位置、装机容量、坝体参数及水库库容等关键信息，并采用交叉验证方法提升了数据质量。该数据集可为水文建模、可再生能源规划及跨流域生态影响评估研究提供高精度基础数据支撑，尤其适用于大尺度水资源管理与气候适应性研究。,2025-04-18,10.1038/s41597-025-04975-0,https://www.nature.com/articles/s41597-025-04975-0,Michelle T. H. van Vliet,"水力发电,水库数据,开放数据集,全球范围,能源基础设施",水文,Scientific Data,
Single cell transcriptome profiling of immune tissues from germ-free and specific pathogen-free piglet,无菌与无特定病原体仔猪免疫组织的单细胞转录组分析,本研究通过单细胞转录组测序技术，构建了无菌猪和特定病原体猪免疫组织的单细胞转录图谱。实验采用10x Genomics平台对脾脏、肠系膜淋巴结等免疫器官进行单细胞分离和文库构建，通过严格的质控流程获得高质量单细胞转录组数据。该数据集为研究猪早期免疫系统发育提供了重要资源，可用于解析微生物定植对免疫细胞功能分化的影响，对比较免疫学和畜牧疫苗研发具有重要价值。,2025-04-18,10.1038/s41597-025-04957-2,https://www.nature.com/articles/s41597-025-04957-2,Liangpeng Ge,"单细胞转录组,免疫组织,无菌猪,特定病原体猪,猪仔",动物学,Scientific Data,
Chromosome-level genome assembly of an important ethnic medicinal plant <i>Callicarpa nudiflora</i>,重要民族药用植物裸花紫珠染色体水平基因组组装,本研究通过高通量测序技术构建了重要民族药用植物裸花紫珠（Callicarpa nudiflora）的染色体级别基因组，详细阐述了从样本采集、文库构建到序列组装与注释的全流程。该高质量基因组数据集填补了该物种遗传信息的空白，为解析其药用成分生物合成途径、种群遗传多样性研究及分子育种提供了关键基础资源，对民族药用植物的保护与开发利用具有重要科学价值。,2025-04-18,10.1038/s41597-025-04999-6,https://www.nature.com/articles/s41597-025-04999-6,Zhonghui Ma,"染色体级别基因组组装,民族药用植物,紫珠属",植物科学,Scientific Data,
ROBIN: Reference observatory of basins for international hydrological climate change detection,ROBIN：国际水文气候变化检测流域基准观测站,本研究构建了ROBIN（国际水文气候变化检测参考流域观测站）数据集，旨在为全球水文气候变化研究提供标准化基准数据。通过整合多源遥感数据、地面观测与再分析资料，采用统一的质量控制与空间插值方法，建立了覆盖全球代表性流域的水文气象要素长时间序列数据集。该数据集支持流域尺度水文过程模拟、气候变化检测与归因分析，并为水文模型验证与跨区域比较研究提供重要数据基础，对提升全球水文气候变化研究的可靠性与可比性具有显著价值。,2025-04-18,10.1038/s41597-025-04907-y,https://www.nature.com/articles/s41597-025-04907-y,P. H. Whitfield,"水文观测,气候变化检测,国际流域,基准观测站,水文气候",水文,Scientific Data,
Five years of high-frequency data of phytoplankton zooplankton and limnology from a temperate eutrophic lake,温带富营养化湖泊浮游植物、浮游动物与湖沼学五年高频观测数据集,该研究构建了一个为期五年的高频监测数据集，记录了温带富营养化湖泊中浮游植物、浮游动物及湖沼学参数的动态变化。数据集通过标准化的采样与分析方法获取，涵盖了多营养级的生物指标和关键环境因子。该资源为揭示富营养化湖泊生态系统的时序变化规律、量化生物与环境因子的互作机制提供了重要基础，尤其适用于生态模型构建、环境变化影响评估及湖泊管理策略优化等研究领域。高频特性使其能够捕捉短期生态波动过程，弥补了传统监测在时间分辨率上的不足。,2025-04-18,10.1038/s41597-025-04988-9,https://www.nature.com/articles/s41597-025-04988-9,Francesco Pomati,"浮游植物,浮游动物,富营养化湖泊,高频监测,温带湖泊",生态,Scientific Data,
A global dataset on mungbean for managing seed yield and quality,全球绿豆数据集：用于管理种子产量与品质,本研究构建了一个全球性绿豆数据集，系统整合了品种特性、农艺性状、环境因子及品质参数等多维度数据。通过标准化采集流程与质量控制体系，实现了跨地区数据的可比性与可靠性。该数据集支持绿豆产量与品质的协同优化分析，为品种选育、栽培管理及全球气候变化下的适应性研究提供了重要数据基础，尤其有助于热带亚热带地区绿豆产业的可持续发展。,2025-04-19,10.1038/s41597-025-05016-6,https://www.nature.com/articles/s41597-025-05016-6,Ignacio A. Ciampitti,"绿豆产量,种子品质,全球数据集,作物管理",植物科学,Scientific Data,
"VocalMind: A Stereotactic EEG Dataset for Vocalized, Mimed, and Imagined Speech in Tonal Language",《VocalMind：针对声调语言发声、默念及想象言语的立体定向脑电图数据集》,本研究构建了VocalMind数据集，包含汉语声调语言环境下发声、默读及想象语音的立体脑电图（sEEG）记录，通过高时空分辨率神经信号捕捉不同语音产生模式的神经表征差异。数据集严格遵循标准化实验范式，采用专业设备同步采集sEEG信号与音频数据，并经过多模态数据对齐和质量控制。该资源为探索声调语言特异性神经机制、发展脑机接口技术及言语障碍诊疗研究提供了重要基础，尤其有助于揭示语音产生三阶段（发声-默读-想象）的神经编码连续性特征。,2025-04-19,10.1038/s41597-025-04741-2,https://www.nature.com/articles/s41597-025-04741-2,Haizhou Li,"脑电图数据集,语音想象,有声与无声语音,声调语言,立体定向脑电图",神经科学,Scientific Data,
"A chromosome-level genome assembly of Gray’s grenadier anchovy, <i>Coilia grayii</i>",灰鳍鲚染色体水平基因组组装,本研究构建了格雷氏鲚(Coilia grayii)染色体水平的高质量基因组组装。通过结合PacBio长读长测序、Hi-C染色质构象捕获和Illumina短读长测序技术，获得了包含24条染色体的全基因组序列，scaffold N50达到XX Mb。该基因组组装为研究鲚属鱼类进化、种群遗传结构和环境适应性提供了重要基础数据，同时也可作为经济鱼类资源保护与可持续利用的分子遗传学参考。,2025-04-19,10.1038/s41597-025-04834-y,https://www.nature.com/articles/s41597-025-04834-y,Jianguo Lu,"染色体水平基因组组装,格氏鲚,鱼类基因组,海洋生物遗传学,基因组测序",遗传学,Scientific Data,
A repository-hosted dataset of volcanic ash particle images and features,火山灰颗粒图像及特征数据集库,"本研究构建了一个包含13座火山53个样本的11,808个火山灰颗粒的开源数据集，涵盖光学显微镜图像、颗粒形状/纹理/颜色等物理特征及四种颗粒类型分类标签。该数据集通过系统采集多源火山喷发颗粒的形态学参数，解决了火山灰分类标准不统一的难题，已成功应用于机器学习分类器开发。其标准化特征数据不仅可为火山监测提供基础支撑，还将推动火山学界建立统一的颗粒分类体系，具有重要的科研与应用价值。",2025-04-23,10.1038/s41597-025-04942-9,https://www.nature.com/articles/s41597-025-04942-9,Hamdi Rifai,"火山灰颗粒,火山喷发监测,机器学习分类,开放数据集,火山学研究",环境科学,Scientific Data,"Volcanic ash is made of particles smaller than 2 mm and is produced during volcanic eruptions. Studying the properties of volcanic ash is key for a range of applications, including volcano monitoring. However, given the large variety of textures, colors, and shapes of particles from different eruptions and volcanoes it is challenging to classify them in a reproducible and systematic manner. Here, we present an open access repository-hosted dataset of 11,808 particles from 53 samples across 13 volcanoes. Particle data includes optical microscope images, physical characteristics of the shape, texture and color, and a classification label with the particle type (free-crystal, altered material, juvenile or lithic). The dataset has already been used to develop particle classifiers with Machine Learning. We plan to continue it to grow and encourage the volcano community to contribute towards standardizing volcanic ash classification."
Single Molecule Localization Super-resolution Dataset for Deep Learning with Paired Low-resolution Images,深度学习配对低分辨率图像的单分子定位超分辨率数据集,深度学习超分辨显微技术近年来发展迅速，但公开数据集的匮乏制约了相关方法的开发。本研究构建了DL-SMLM生物图像数据集，包含微管、内质网腔/膜、网格蛋白包被小窝、线粒体内/外膜等6种亚细胞结构的188组原始单分子定位显微数据，每幅低分辨率图像提供100种信号水平，通过数据分割可生成数千组训练对。利用DNA折纸样本验证了成像系统性能，并展示了基于该数据集训练的超分辨模型实例，证实了DL-SMLM在推动深度学习超分辨显微技术发展中的应用价值。,2025-04-23,10.1038/s41597-025-04979-w,https://www.nature.com/articles/s41597-025-04979-w,Wei Ji,"深度学习超分辨显微术,单分子定位显微术,生物图像数据集,超分辨率训练数据,细胞器结构成像",生物技术,Scientific Data,"Deep learning super-resolution microscopy has advanced rapidly in recent years. Super-resolution images acquired by single molecule localization microscopy (SMLM) are ideal sources for high-quality datasets. However, the scarcity of public datasets limits the development of deep learning methods. Here, we describe a biological image dataset, DL-SMLM, which provides paired low-resolution fluorescence images and super-resolution SMLM data for training super-resolution models. DL-SMLM consists of six different subcellular structures, including microtubules, lumen and membrane of endoplasmic reticulum (ER), Clathrin coated pits (CCPs), outer membrane of mitochondria (OMM) and inner membrane of mitochondria (IMM). There are 188 sets of raw SMLM data and 100 signal levels for each low-resolution image. This allows software developers to generate thousands of training pairs through data segmentation. The performance of the imaging system was further evaluated using DNA origami samples. Finally, we demonstrated examples of super-resolution models trained using data from DL-SMLM, highlighting the effectiveness of DL-SMLM for developing deep learning super-resolution microscopy."
HindwingLib: A library of leaf beetle hindwings generated by Stable Diffusion and ControlNet,HindwingLib：基于Stable Diffusion与ControlNet的叶甲后翅图像库,本研究提出了一种基于Stable Diffusion和ControlNet的甲虫后翅图像生成方法，通过对200种叶甲后翅样本的应用验证了该技术的有效性。针对传统甲虫后翅数据采集面临的样本稀缺、制备复杂和公开获取受限等问题，该方法利用预训练模型实现了高质量合成图像的统计生成。通过结构相似性指数(SSIM)、初始分数(IS)和弗雷歇初始距离(FID)三项关键指标的对比分析，证实合成图像与真实数据具有高度一致性。所构建的叶甲后翅图像库不仅为机器学习研究提供了形态学数据支持，更展示了该方法在生物形态学研究中的广泛应用潜力。,2025-04-23,10.1038/s41597-025-05010-y,https://www.nature.com/articles/s41597-025-05010-y,SiQin Ge,"甲虫后翅数据集,稳定扩散模型,图像生成,形态学分析,进化研究",动物学,Scientific Data,"The utilization of datasets from beetle hindwings is prevalent in research of morphology and evolution of beetles, serving as a valuable tool for comprehending the evolutionary processes and functional adaptations under specific environmental conditions. However, the collection of hindwing images of beetles poses several challenges, including limited sample availability, complex sample preparation procedures, and restricted public accessibility. Recently, a machine learning technique called Stable Diffusion has been developed to statistically generate diverse images using a pretrained model with prompts. In this study, we introduce an approach utilizing Stable diffusion and ControlNet for the generation of beetle hindwing images, along with the corresponding results obtained from its application to a diverse set of 200 leaf beetle hindwings. To demonstrate the fidelity of the synthetic hindwing images, we conducted a comprarative analysis of three key metrics: Structural Similarity Index (SSIM), Inception Score (IS), and Fréchet Inception Distance (FID), which are crucial for evaluating image fidelity. The results demonstrated a strong alignment between the actual data and the synthetic images, confirming their high fidelity. This novel library of leaf beetle hindwings not only offers morphological image for utilization in machine learning, but also showcases the extensive applicability of the proposed methodology."
