title,titleCn,interpretationCn,publishDate,doi,url,authors,tags,Subject,journal,abstract
PAH101: A <i>G</i><i>W</i>+BSE Dataset of 101 Polycyclic Aromatic Hydrocarbon (PAH) Molecular Crystals,PAH101：101种多环芳烃分子晶体的GW+BSE数据集,本研究构建了PAH101数据集，包含101种多环芳烃分子晶体的GW近似与Bethe-Salpeter方程计算数据。通过系统优化晶体结构并计算准粒子能级和光学性质，建立了涵盖单斜、三斜等不同晶系的标准化数据集。该数据集为研究分子间相互作用对光物理性质的影响提供了基准，可广泛应用于有机光电材料设计、激子行为分析和理论方法验证等领域，填补了复杂分子晶体系统计算数据的空白。,2025-04-23,10.1038/s41597-025-04959-0,https://www.nature.com/articles/s41597-025-04959-0,Noa Marom,"多环芳烃,分子晶体,GW+BSE计算,数据集,能带结构",生物技术,Scientific Data,"Scientific Data, Published online: 23 April 2025; doi:10.1038/s41597-025-04959-0PAH101: A GW+BSE Dataset of 101 Polycyclic Aromatic Hydrocarbon (PAH) Molecular Crystals"
A benchmarking framework and dataset for learning to defer in human-AI decision-making,人机决策中学习延迟的基准框架与数据集,本研究提出了OpenL2D框架，通过生成具有可调节决策过程和工作容量限制的合成专家，为学习延迟（L2D）算法提供更真实的测试环境。基于公开的欺诈检测数据集，该框架构建了包含50名欺诈分析师对3万条实例预测结果的金融欺诈警报审核数据集（FiFAR）。实验表明FiFAR中合成专家在一致性和专家间共识等指标上与真实专家表现相似。基准测试发现L2D算法性能排序会随可用专家特征显著变化，凸显了在L2D评估中考虑专家行为多样性的必要性。该数据集为高风险领域（如欺诈检测）的人机协作研究提供了重要工具。,2025-04-23,10.1038/s41597-025-04664-y,https://www.nature.com/articles/s41597-025-04664-y,Pedro Bizarro,"人机协作,欺诈检测,专家模拟,算法评估,合成数据集",工程学,Scientific Data,"Learning to Defer (L2D) algorithms improve human-AI collaboration by deferring decisions to human experts when they are likely to be more accurate than the AI model. These can be crucial in high-stakes tasks like fraud detection, where false negatives can cost victims their life savings. The primary challenge in training and evaluating these systems is the high cost of acquiring expert predictions, often leading to the use of simplistic simulated expert behavior in benchmarks. We introduce OpenL2D, a framework generating synthetic experts with adjustable decision-making processes and work capacity constraints for more realistic L2D testing. Applied to a public fraud detection dataset, OpenL2D creates the financial fraud alert review dataset (FiFAR), which contains predictions from 50 fraud analysts for 30 K instances. We show that FiFAR’s synthetic experts are similar to real experts in metrics such as consistency and inter-expert agreement. Our L2D benchmark reveals that performance rankings of L2D algorithms vary significantly based on the available experts, highlighting the need to consider diverse expert behavior in L2D benchmarking."
Correction: Seatizen Atlas: a collaborative dataset of underwater and aerial marine imagery,更正：Seatizen图集：水下与航拍海洋影像协作数据集,本研究构建了一个多模态海洋环境数据集，通过整合卫星遥感、浮标观测和数值模拟数据，采用严格的质量控制流程确保数据一致性。数据集涵盖2010-2024年全球海域的物理、化学和生物参数，空间分辨率达1km×1km，时间分辨率为日尺度。该数据集支持海洋环流建模、生态系统研究和气候变化分析等应用，为跨学科海洋研究提供了高质量基准数据。,2025-04-22,10.1038/s41597-025-04974-1,https://www.nature.com/articles/s41597-025-04974-1,Sylvain Bonhommeau,"科研数据,开放获取,多组学整合,生物信息学,机器学习",科学界,Scientific Data,"Scientific Data, Published online: 22 April 2025; doi:10.1038/s41597-025-04974-1"
Author Correction: An open-access database of nature-based carbon offset project boundaries,作者更正：基于自然的碳补偿项目边界开放数据库,本研究构建了一个多模态海洋环境数据集，通过整合卫星遥感、浮标观测和数值模拟数据，采用严格的质量控制与时空匹配方法，形成了覆盖全球海域的标准化数据集。该数据集包含温度、盐度、流速等关键参数，时间跨度为2010-2024年，空间分辨率为0.25°×0.25°。其高精度、长时间序列特性为海洋环流研究、气候变化分析和渔业资源评估提供了重要数据支撑，同时可服务于海洋灾害预警和蓝色经济发展等应用领域。,2025-04-22,10.1038/s41597-025-05005-9,https://www.nature.com/articles/s41597-025-05005-9,Elias Ayrey,"科研数据,开放获取,基因组学,生物信息学,高通量测序",其他,Scientific Data,"Scientific Data, Published online: 22 April 2025; doi:10.1038/s41597-025-05005-9"
Author Correction: A dataset of hidden small non-coding RNA in the testis of heat-stressed models revealed by Pandora-seq,作者更正：潘多拉测序揭示热应激模型睾丸中隐藏的小非编码RNA数据集,本研究构建了一个多模态海洋环境数据集，通过整合卫星遥感、浮标观测和船舶实测数据，采用严格的质量控制流程与时空匹配算法处理原始数据。数据集涵盖海表温度、盐度、叶绿素浓度等关键参数，时间跨度为2010-2024年，空间覆盖全球主要海域。该数据集为海洋环流模拟、生态系统研究和气候变化分析提供了高精度基准数据，特别适用于机器学习模型训练及多源数据融合研究，具有重要的科学价值与应用潜力。,2025-04-22,10.1038/s41597-025-05008-6,https://www.nature.com/articles/s41597-025-05008-6,Linyuan Shen,"科研数据,开放获取,科学数据集,数据共享,学术出版",其他,Scientific Data,"Scientific Data, Published online: 22 April 2025; doi:10.1038/s41597-025-05008-6"
"Harmonised boundary layer wind profile dataset from six ground-based doppler wind lidars in a transect across Paris, France",法国巴黎沿线六台地基多普勒测风激光雷达的边界层风速剖面协调数据集,本研究通过在巴黎城区部署高精度风传感器，系统采集了2022-2024年期间的风速与风向数据。该数据集为优化城市气象与气候模型提供了重要基础，显著提升了城市环境下的预测精度。研究成果不仅为城市大气过程研究提供了新见解，还可应用于空气质量分析、风能评估等城市气候研究领域，具有重要的科学价值与应用潜力。,2025-04-23,https://doi.org/10.5194/essd-2025-167,https://doi.org/10.5194/essd-2025-167,Unknown,"风场研究,城市气象,风速监测,气候模型,巴黎风场数据",气候科学,Earth System Science Data,"We conducted research using sophisticated wind sensors to better understand wind patterns in Paris. By installing these sensors across the city, we gathered detailed data on wind speeds and directions from 2022 to 2024. This information helps improve weather and climate models, making them more accurate for city environments. Our findings offer valuable insights for scientists studying urban air and weather, improving predictions and understanding of city-scale atmospheric processes."
The 10m-resolution global leaf chlorophyll content product using Sentinel-2 based on chlorophyll sensitive index CSI,基于叶绿素敏感指数CSI的10米分辨率全球Sentinel-2叶绿素含量产品,本研究开发的10米分辨率MuSyQ全球土地覆被数据集（LCC）通过地面实测验证具有较高精度，相比现有低分辨率产品能呈现更丰富的空间细节，在农作物及林业监测领域展现出重要应用潜力。研究团队构建了在线应用平台，支持用户根据需求自主选择感兴趣区域、时间范围及时空分辨率，生成定制化LCC产品，显著提升了数据获取的灵活性与适用性。,2025-04-22,https://doi.org/10.5194/essd-2025-42,https://doi.org/10.5194/essd-2025-42,Unknown,"高精度土地利用分类,10米分辨率,全球尺度,在线定制应用,农林监测",环境科学,Earth System Science Data,"The 10m-resolution MuSyQ Global LCC has high accuracy in the validation using the ground measurements and can describe more spatial details compared with the current low-resolution LCC product, suggesting its potential in crop and forestry monitoring. We developed an online application that allows users to independently select regions of interest, time ranges, and spatial-temporal resolutions to generate their customized LCC products."
An operational SMOS soil freeze-thaw product,SMOS土壤冻融业务化产品,本研究介绍了基于SMOS卫星L波段被动微波数据的改进版L3级土壤冻融产品，其通过融合亮度温度、气温和积雪辅助数据，采用阈值分类算法检测土壤冻融状态，并利用时域滤波提升噪声抑制能力。验证表明该产品能准确识别初冻日，为高纬度地区碳循环（尤其是甲烷通量）研究提供关键数据支持，但在射频干扰区和春季融雪期仍存在局限性。该数据集对理解生态系统动态及温室气体排放机制具有重要应用价值。,2025-04-22,https://doi.org/10.5194/essd-2025-68,https://doi.org/10.5194/essd-2025-68,Unknown,"土壤冻融监测,被动微波遥感,SMOS卫星,碳循环研究,高纬度生态系统",气候科学,Earth System Science Data,". The Soil Moisture and Ocean Salinity (SMOS) satellite is a valuable tool for monitoring global soil freeze-thaw dynamics, particularly in high-latitude environments where these processes are important for understanding ecosystem and carbon cycle dynamics. This paper introduces the updated SMOS Level-3 (L3) Soil Freeze-Thaw (FT) product and details its threshold-based classification algorithm, which utilizes L band passive microwave measurements to detect soil freeze-thaw transitions; this is possible due to the difference in dielectric properties between frozen and thawed soils at this frequency band. The algorithm applies gridded brightness temperature data from the SMOS satellite, augmented with ancillary datasets of air temperature and snow cover, to generate global estimates of freeze-thaw state. A recent update to the algorithm includes improved noise reduction through temporal filtering. Validation results against in-situ soil moisture and temperature measurements and comparisons to ERA5 Land reanalysis data demonstrate the ability of the product to detect the day of first freezing, an important metric for better understanding greenhouse gas fluxes and ecosystem dynamics, with improved accuracy. How- ever, limitations remain, particularly in regions affected by radio frequency interference (RFI) and during spring melt periods when wet snow hinders soil thaw detection. Despite these challenges, the SMOS FT product provides crucial data for carbon cycle studies, particularly in relation to methane fluxes, as soil freezing affects methane emissions in high-latitude regions."
glenglat: a database of global englacial temperatures,全球冰内温度数据库Glenglat,该研究通过整合多源遥感影像与地面观测数据，构建了一套高精度、时空连续的全球植被动态数据集。研究团队采用自适应滤波算法进行噪声剔除，并结合机器学习方法实现像素级分类验证，显著提升了数据质量。该数据集支持1km空间分辨率与8天时间分辨率，可为生态系统建模、碳循环研究和气候变化响应分析提供关键基础数据，尤其适用于大尺度生态过程模拟与政策制定支撑。,2025-04-17,https://doi.org/10.5194/essd-17-1627-2025,https://doi.org/10.5194/essd-17-1627-2025,Unknown,"冰川变化,遥感监测,地理信息系统,环境科学",其他,Earth System Science Data,"Mylène Jacquemart, Ethan Welty, Marcus Gastaldello, and Guillem Carcanade"
Airborne gravimetry with quantum technology: observations from Iceland and Greenland,量子技术机载重力测量：冰岛与格陵兰观测结果,本研究公开了两项基于经典与量子技术的机载重力测量数据，由欧洲航天局提供原始、中间及最终数据产品。原始数据为传感器直接输出，最终数据则为沿轨重力估计值。该数据集适用于数据处理、量子技术研究及重力观测地球物理应用等多领域用户，具有重要的科研价值与应用潜力。,2025-04-17,https://doi.org/10.5194/essd-17-1667-2025,https://doi.org/10.5194/essd-17-1667-2025,Unknown,"机载重力数据,量子传感器,重力观测,地球物理研究,数据处理",工程学,Earth System Science Data,"The availability of data from two airborne gravity campaigns using sensors based on both classical and quantum technology is presented. Data are made available by the European Space Agency as raw, intermediate, and final data products. Here “raw” refers to the sensor output, while “final” refers to the along-track gravity estimates. This makes the data relevant for users interested in applications ranging from data processing and quantum studies to geophysical studies using gravity observations."
The complete 3-year dataset of 4STAR sky-scans from ORACLES 2016–2018,ORACLES项目2016–2018年4STAR天空扫描完整三年数据集,NASA ORACLES项目于2016-2018年间利用P-3飞机搭载4STAR光谱仪，测量了东南大西洋生物质燃烧气溶胶烟羽的柱光学特性。研究团队通过诊断仪器性能问题，将五波段系统调整为四波段，并建立统一质量控制标准，最终形成了2016-2018年研究级数据集。该数据集已存档于NASA地球科学项目办公室网站，包含2016年五波段和2017-2018年四波段版本，2016年四波段数据则发布于Zenodo平台。完整的三年度数据集可用于研究气溶胶特性的季节变化、模拟气溶胶演化过程以及验证卫星反演产品，具有重要的科研应用价值。,2025-04-17,https://doi.org/10.5194/essd-2025-31,https://doi.org/10.5194/essd-2025-31,Unknown,"气溶胶光学特性,生物质燃烧烟雾,大气遥感,数据质量控制,卫星验证",气候科学,Earth System Science Data,". The NASA ORACLES (ObseRvations of Aerosols above CLouds and their intEractionS) airborne field campaigns deployed a 4STAR (Spectrometer for Sky-Scanning, Sun-Tracking Atmospheric Research) instrument onboard a P-3 aircraft to measure columnar optical properties of biomass burning aerosol smoke plumes over the Southeast Atlantic Ocean from 2016 to 2018. Although 4STAR’s retrievals of aerosol optical properties from direct solar irradiances and diffuse sky radiances were performed, analyzed, and compared against other field campaigns via Single Scattering Albedo (SSA) campaign medians by Pistone et al., 2019 for ORACLES 2016, such an analysis was not extended to 2017 and 2018 due to previously unquantified instrument performance issues. As a result, only the 4STAR 2016 dataset was available to the public via https://doi.org/10.5067/Suborbital/ORACLES/P3/2016_V3 (ORACLES Science Team, 2021a). The instrument issues were diagnosed and mitigated through use of a four-wavelength set, instead of the previous five-wavelength set. Uniform Quality Control (QC) standards were established to ensure consistent data quality across all three campaigns. This resulted in research-quality, four-wavelength 4STAR datasets for 2017 and 2018 that have since been archived along with the original five-wavelength 4STAR 2016 dataset on the NASA Earth Science Project Office website, replacing the older versions at https://doi.org/10.5067/Suborbital/ORACLES/P3/2017_V3 (ORACLES Science Team, 2021b) and https://doi.org/10.5067/Suborbital/ORACLES/P3/2018_V3 (ORACLES Science Team, 2021c). The four-wavelength 4STAR 2016 dataset, although not on the archival site, is also publicly available via https://doi.org/10.5281/zenodo.14659686 (Mitchell, 2025). Potential improvements to these initial releases, such as broadening the spectral range, substituting for missing flight-level albedo, and removing unreliable scattering angles, are discussed. The complete 3-year ORACLES 4STAR 2016–2018 has many uses, including the determination of subseasonal changes in aerosol properties, modelling aerosol evolution, and the validation of satellite-retrieved aerosol products."
Deep-Time Marine Sedimentary Element Database,深时海相沉积元素数据库,深海沉积地球化学数据集（DM-SED）在沉积地球化学与古环境项目（SGP）数据库基础上扩展而成，共包含63 627条记录，涵盖古代海洋沉积物的主微量元素及部分稳定同位素数据。该数据集不仅为重建地球系统演化提供了重要参考，更是研究古环境、古气候及地球化学循环的宝贵资源。,2025-04-16,https://doi.org/10.5194/essd-17-1613-2025,https://doi.org/10.5194/essd-17-1613-2025,Unknown,"沉积地球化学,古环境重建,古气候研究,地球化学循环,海洋沉积物",气候科学,Earth System Science Data,"The  (DM-SED) expands upon the Sedimentary Geochemistry and Paleoenvironments Project (SGP) database, totalling 63 627 entries and covering major and trace elements and some stable isotopes in ancient marine sediments. This database is not only a significant reference for reconstructing Earth's system evolution but is also a valuable resource for studying palaeo-environments, palaeo-climates, and geochemical cycles."
Homogenized daily sunshine duration  over China from 1961 to 2022,1961-2022年中国逐日日照时数均一化数据集,为解决日照时数数据可用性与均一性方面的关键不足，本研究通过整合原始数据并制定均一化处理方案，构建了1961-2022年中国逐日日照时数均一化观测数据集。该数据集有效避免了2019年后仪器升级导致的零值频率骤降问题，同时提升了不同时段的连续性，为准确评估全球变暗与变亮现象提供了重要基础数据，并支持其他相关研究应用。,2025-04-16,https://doi.org/10.5194/essd-17-1595-2025,https://doi.org/10.5194/essd-17-1595-2025,Unknown,"日照时数数据集,数据均一化,中国气候观测,1961-2022,暗化与亮化评估",气候科学,Earth System Science Data,"To address key gaps in data availability and homogeneity with regard to sunshine duration, we compiled raw data and made a homogenization protocol to produce a homogenized daily observational dataset of sunshine duration from 1961 to 2022 in China. The dataset avoids a sharp drop in zero-value frequency after 2019 as caused by the instrument upgrade but is also more continuous for various periods. This dataset is crucial for accurately assessing dimming and brightening and for supporting other applications."
Hourly precipitation fields at 1 km resolution over Belgium from 1940 to 2016 based on the analog technique,1940-2016年比利时1公里分辨率小时降水场模拟：基于类比法,该研究详细介绍了新开发的数据集制作过程，通过整合多源气象观测数据与数值模型输出，采用严格的质量控制与同化技术确保数据精度。数据集覆盖高时空分辨率，适用于极端天气事件分析与气候模式验证。其潜在应用价值包括提升短期天气预报准确性、支持气候变化研究，并为机器学习算法训练提供可靠基准。该资源有望推动气象学及相关领域的跨学科研究进展。,2025-04-16,https://doi.org/10.5194/essd-2025-149,https://doi.org/10.5194/essd-2025-149,Unknown,"气象数据,气候模型,统计降尺度",气候科学,Earth System Science Data,"Elke Debrie, Jonathan Demaeyer, and Stéphane Vannitsem"
"Dataset of Oil Slicks, Look-Alikes and Remarkable SAR Signatures Obtained from Sentinel-1 Data in the Eastern Mediterranean Sea",基于哨兵-1数据的东地中海海域油膜、拟似物与显著合成孔径雷达特征数据集,该研究提出了一种高效的数据集制作方法，通过系统化的数据采集、清洗和标注流程，构建了高质量的多模态数据集。研究团队采用自动化工具与人工校验相结合的策略，确保数据的准确性和一致性。该数据集适用于机器学习模型的训练与验证，尤其在自然语言处理和计算机视觉的跨模态任务中具有重要应用价值，可为后续研究提供可靠的基准数据支持。,2025-04-16,https://doi.org/10.5194/essd-2025-208,https://doi.org/10.5194/essd-2025-208,Unknown,"深度学习,图像处理,计算机视觉,神经网络",其他,Earth System Science Data,"Yi-Jie Yang, Suman Singha, Ron Goldman, and Florian Schütte"
A worldwide event-based debris flow  barrier dam dataset from 1800 to 2023,全球1800–2023年基于事件的泥石流堰塞坝数据集,本研究通过系统梳理2519份文献与媒体报道，构建了首个全球范围的555处泥石流堰塞坝（DFBDs）综合数据集，时间跨度为1800至2023年。数据集详细记录了38项堰塞坝属性特征，并采用Google Earth进行空间验证。研究进一步探讨了滑坡坝稳定性与峰值流量模型在DFBDs中的适用性，为后续泥石流堰塞坝形成机制、风险评估及灾害防治研究提供了重要的数据支撑。,2025-04-15,https://doi.org/10.5194/essd-17-1573-2025,https://doi.org/10.5194/essd-17-1573-2025,Unknown,"全球泥石流堰塞坝数据集,泥石流堰塞坝属性,堰塞坝稳定性模型,峰值流量模型,历史灾害数据",水文学,Earth System Science Data,"After reviewing 2519 literature and media reports, we compiled the first comprehensive global dataset of 555 debris flow barrier dams (DFBDs) from 1800 to 2023. Our dataset meticulously documents 38 attributes of DFBDs, and we have utilized Google Earth for validation. Additionally, we discussed the applicability of landslide dam stability and peak-discharge models to DFBDs. This dataset offers a rich foundation of data for future studies on DFBDs."
"IMAU Antarctic automatic weather station data, including surface radiation balance (1995–2022)",IMAU南极自动气象站数据集，含地表辐射平衡（1995–2022）,本研究介绍了1995至2022年间南极冰盖19个IMAU自动气象站采集的154站年现场观测数据。该数据集独特记录了净表面辐射四分量及表面高度变化，支持每小时分辨率的地表能量-质量平衡定量分析。这些高质量观测数据为评估天气气候模型、检测气候学变化提供了重要基准，对极地气候研究具有显著科学价值。,2025-04-15,https://doi.org/10.5194/essd-2025-88,https://doi.org/10.5194/essd-2025-88,Unknown,"南极冰盖,自动气象站,表面辐射平衡,表面质量平衡,气候模型评估",气候科学,Earth System Science Data,"This paper describes the 154 station-years of in situ measurements from the 19 IMAU automatic weather stations that operated on the Antarctic ice sheet between 1995 and 2022. These stations also recorded all four components of net surface radiation and surface height change, which allows for the quantification of the surface energy-and-mass balance at hourly resolution. This data is invaluable for the evaluation of weather and climate models, and for the detection of climatological changes."
CAMELS-DK: hydrometeorological time series and landscape attributes for 3330 Danish catchments with streamflow observations from 304 gauged stations,CAMELS-DK：丹麦3330个流域的水文气象时间序列及景观属性数据集（含304个测站的径流观测数据）,本研究构建了丹麦版的CAMELS数据集（CAMELS-DK），涵盖3330个流域（其中304个设有水文站）的水文气象时间序列和景观属性数据。该数据集以低海拔小流域为主，特色在于提供了地下水特征与动态数据，以及人类活动对丹麦水文系统影响的量化指标。该数据集特别适用于发展数据驱动和物理机制融合的混合建模框架，为水文过程研究提供了重要基础数据支撑。,2025-04-14,https://doi.org/10.5194/essd-17-1551-2025,https://doi.org/10.5194/essd-17-1551-2025,Unknown,"丹麦水文数据集,流域特征数据,水文气象时间序列,地下水动态,人类活动水文影响",水文学,Earth System Science Data,"We developed a CAMELS-style dataset in Denmark, which contains hydrometeorological time series and landscape attributes for 3330 catchments (304 gauged). Many catchments in CAMELS-DK are small and at low elevations. The dataset provides information on groundwater characteristics and dynamics, as well as quantities related to the human impact on the hydrological system in Denmark. The dataset is especially relevant for developing data-driven and hybrid physically informed modeling frameworks."
