title,titleCn,interpretationCn,publishDate,doi,url,authors,tags,Subject,journal,abstract
An in situ daily dataset for benchmarking temporal variability of groundwater recharge,原位日数据集用于基准化地下水补给时间变异性,本研究构建了美国485个地下水监测井的每日单位给水度地下水补给量(RpSy)数据集，填补了日尺度基准补给数据的空白。该数据集可用于验证陆面模型和水文模型产出的补给数据时间一致性，并为评估补给-驱动因子间的函数关系提供基础，对改进地下水动态模拟具有重要意义。,2025-04-14,https://doi.org/10.5194/essd-17-1515-2025,https://doi.org/10.5194/essd-17-1515-2025,Unknown,"地下水补给,单位给水度,监测井数据,模型验证,水文模型",水文学,Earth System Science Data,"Groundwater dynamics depend on groundwater recharge, but daily benchmark data of recharge are scarce. Here we present a daily groundwater recharge per unit specified yield (RpSy) data at 485 US groundwater monitoring wells. RpSy can be used to validate the temporal consistency of recharge products from land surface and hydrologic models and facilitate assessment of recharge-driver functional relationships in them."
Distribution and sources of fallout 137Cs and 239+240Pu in equatorial and Southern Hemisphere reference soils,沉降核素¹³⁷Cs与²³⁹⁺²⁴⁰Pu在赤道及南半球基准土壤中的分布与来源,本研究通过整合文献中137Cs和239+240Pu等沉降放射性核素(FRNs)的土壤参考数据，构建了综合性数据库，系统分析了这些核素的分布特征与来源。基于该数据库，研究进一步采用机器学习算法揭示了影响FRNs分布的关键环境因子，为环境地球化学研究、核污染监测及生态风险评估提供了重要的数据支撑与方法学参考。,2025-04-14,https://doi.org/10.5194/essd-17-1529-2025,https://doi.org/10.5194/essd-17-1529-2025,Unknown,"放射性核素,土壤数据库,环境分布,机器学习,源解析",环境科学,Earth System Science Data,"Fallout radionuclides (FRNs) such as 137Cs and 239+240Pu are considered to be critical tools in various environmental research. Here, we compiled reference soil data on these FRNs from the literature to build a comprehensive database. Using this database, we determined the distribution and sources of 137Cs and 239+240Pu. We also demonstrated how the database can be used to identify the environmental factors that influence their distribution using a machine learning algorithm."
Monitoring CO2 in diverse European cities: Highlighting needs and challenges through characterisation,监测欧洲多城市二氧化碳：通过特征分析揭示需求与挑战,"为建立欧洲联合二氧化碳排放监测能力，本研究开发了""CO2监测挑战城市地图集v1.0""框架（CMC-CITYMAP），包含基于Jupyter notebook的分析工具。该工具通过四大核心挑战维度（背景浓度确定、人为与生物源分离、非均匀排放建模及特殊观测策略）对308个城市进行特征分析与聚类，重点研究了96个人口超20万的城市（以巴黎、慕尼黑和苏黎世为试点）。研究表明，慕尼黑的监测难度低于巴黎；苏黎世和巴黎在排放建模挑战中表现最为突出，而慕尼黑的主要挑战在于特殊观测策略实施。聚类分析显示布拉迪斯拉发和哥本哈根与现有试点城市差异显著，可作为ICOS城市网络的重要补充，为应对不同监测挑战提供新见解。",2025-04-14,https://doi.org/10.5194/essd-2025-63,https://doi.org/10.5194/essd-2025-63,Unknown,"二氧化碳监测,城市聚类,排放建模,ICOS城市项目,欧洲联合能力",气候科学,Earth System Science Data,". For the development of a joint European capacity for monitoring CO2 emissions, we created the framework ""CO2 Monitoring Challenges City Mapbooks v1.0"" (acronym CMC-CITYMAP). It includes a Jupyter notebook tool (Storm et al., 2025a, https://doi.org/10.18160/P8SV-B99F) which we use to characterise and cluster cities based on aspects relevant for different CO2 monitoring challenges, including (a) determining background levels of CO2 inflow into a city (""background challenge""), (b) separating the anthropogenic emissions from the influence of the biosphere (""biogenic challenge""), (c) representing spatially and temporally non-uniform emissions in models (""modelling challenge""), and (d) implementing observation strategies not covered by the other challenges (""application-specific observational challenge""). We provide and discuss the challenges city-by-city basis, but our primary focus is on the relationships between cities: best practices and lessons learned from monitoring CO2 emissions in one city can be transferred to other cities with similar characteristics. Additionally, we identify cities with characteristics that strongly contrast with those of cities with existing urban monitoring systems. While the notebook tool includes 308 cities, this paper focuses on the results for 96 cities with more than 200,000 inhabitants, with a particular emphasis on Paris, Munich, and Zurich. These cities are pilot cities for the Horizon 2020-funded project Pilot Application in Urban Landscapes (""ICOS Cities""), where a range of urban CO2 monitoring methods are being implemented and assessed. According to our analyses, Zurich — and Munich especially — should be less challenging to monitor than Paris. Examining the challenges individually reveals that the most significant relative challenge is the ""modelling challenge"" (c) for Zurich and Paris. Complex urban topography adds to the challenge for both cities, and in Zurich, the natural topography further amplifies the challenge. Munich has low scores across all challenges, but with the greatest challenge anticipated from the ""application-specific observational challenge"" (d). Overall, Bratislava (Slovakia) and Copenhagen (Denmark) are among the most distant from Paris, Munich, and Zurich in our dendrogram resulting from numerical cluster-analysis. This makes them strong candidates for inclusion in the ICOS Cities network, as they would potentially provide the most information on how to monitor emissions in cities that face different challenges."
Spatially adaptive estimation of multi-layer soil temperature at a daily time-step across China during 2010–2020,2010–2020年中国多层土壤温度逐日时空自适应估算研究,本研究基于地面观测、卫星遥感和气象数据，采用机器学习方法构建了2010-2020年中国高分辨率逐日土壤温度数据集，精确刻画了不同深度土壤温度的时空变化特征。该数据集为农业精准管理和生态系统研究提供了重要的数据支撑。,2025-04-14,https://doi.org/10.5194/essd-2025-192,https://doi.org/10.5194/essd-2025-192,Unknown,"高分辨率土壤温度数据集,中国区域,机器学习方法,时空变化,农业生态研究",环境科学,Earth System Science Data,"This study developed a high-resolution daily soil temperature dataset across China from 2010 to 2020. By combining ground measurements, satellite observations, and weather data with a machine learning method, we accurately captured the spatial and temporal variations of soil temperature at different depths. The dataset offers a scientific basis for agricultural management and ecological research."
"Time series of the summertime diurnal variability in the atmospheric water vapour isotopic composition at Concordia station, East Antarctica",东南极洲康科迪亚站夏季大气水汽同位素组成的日变化时间序列,本研究提供了2023-2024年南半球夏季期间南极高原Concordia站大气水汽同位素组成（δ18O、δD和d-excess）的2.5个月新型观测记录。通过两台独立激光光谱仪精确捕捉了水汽同位素的日变化特征，并将实测数据与同位素大气环流模式LMDZ6-iso的输出结果进行对比，验证了该数据集在评估同位素模型性能方面的应用价值。,2025-04-14,https://doi.org/10.5194/essd-2025-35,https://doi.org/10.5194/essd-2025-35,Unknown,"大气水汽同位素,南极高原,激光光谱仪,同位素模型验证,昼夜变化",气候科学,Earth System Science Data,"We present a novel 2.5-month record of the atmospheric water vapour isotopic composition during the austral summer 2023–2024 at Concordia Station on the Antarctic Plateau. We show that two independent laser spectrometers accurately record the diurnal variability of the atmospheric water vapour 𝛿18O, 𝛿D, and d-excess. We compare the measurements against outputs of the isotope-enabled general circulation model LMDZ6-iso to show how the data can be used to evaluate such models."
"Observations of surface energy fluxes and meteorology in the seasonally snow-covered high-elevation  East River watershed during SPLASH, 2021–2023",2021–2023年SPLASH项目期间东河高海拔季节性积雪流域地表能量通量与气象观测,"2021年秋季至2023年夏季，美国国家海洋和大气管理局（NOAA）等机构在科罗拉多州东河流域开展了""降水、低层大气与地表水文气象研究""（SPLASH），通过布设两处无电网支持的自主单层通量塔（ASFS），系统观测了大气-地表能量交换过程。站点分别位于哥特镇附近的Kettle Ponds Annex（2021.9.28-2023.7.19）和Avery Picnic（2021.10.12-2023.6.21），采集了分钟级气象要素、辐射通量、20Hz三维风/水汽/CO2及土壤/积雪剖面数据，总体数据获取率达90%以上，累计1184天。该数据集（Zenodo存档）为地表能量平衡研究提供了高时空分辨率观测基础，并支持水文气象模型的验证与改进。",2025-04-11,https://doi.org/10.5194/essd-17-1481-2025,https://doi.org/10.5194/essd-17-1481-2025,Unknown,"大气表面通量观测,能量平衡测量,水文气象学,自主监测系统,科罗拉多东河流域",水文学,Earth System Science Data,"From autumn 2021 through summer 2023, scientists from the National Oceanic and Atmospheric Administration (NOAA) and partners conducted the Study of Precipitation, the Lower Atmosphere, and Surface for Hydrometeorology (SPLASH) campaign in the East River watershed of Colorado. One objective of SPLASH was to observe the transfer of energy between the atmosphere and the surface, which was done at several locations. Two remote sites were chosen that did not have access to power utilities. These were along the valley floor near the East River in the vicinity of the unincorporated town of Gothic, Colorado. Energy balance measurements were made at these locations using autonomous, single-level flux towers referred to as atmospheric surface flux stations (ASFSs). The ASFSs were deployed on 28 September 2021 at the Kettle Ponds Annex site and on 12 October 2021 at the Avery Picnic site and operated until 19 July and 21 June 2023, respectively. Measurements included basic meteorology; upward and downward longwave and shortwave radiative fluxes and subsurface conductive flux, each at 1âmin resolution; 3-D winds from a sonic anemometer and H2O/CO2 from an open-path gas analyzer, both at 20âHz from which sensible, latent heat, and CO2 fluxes were derived; and profiles of soil properties in the upper 0.5âm (both sites) and temperature profiles through the snow (at Avery Picnic), each reported between 10âmin and 6âh. The system uptime was 97â% (Kettle Ponds) and 90â% (Avery Picnic), and collectively 1184âd of data was obtained between the stations. The purpose of this article is to document the ASFS deployment at SPLASH, to document the data acquisition and post-processing of measurements, and to serve as a guide for interested users of the data sets, which are archived at Zenodo (https://doi.org/10.5281/zenodo.10313363, Cox et al., 2023b; https://doi.org/10.5281/zenodo.10327409, Cox et al., 2023c; https://doi.org/10.5281/zenodo.10313894, Cox et al., 2023d; https://doi.org/10.5281/zenodo.10307825, Cox et al., 2023e; https://doi.org/10.5281/zenodo.10310520, Cox et al., 2023f) with the Creative Commons AttributionÂ 4.0 International license."
MDG625: a daily high-resolution meteorological  dataset derived by a geopotential-guided  attention network in Asia (1940–2023),MDG625：亚洲地区基于位势高度引导注意力网络的日分辨率气象数据集（1940–2023）,本研究提出基于位势引导注意力网络(GeoAN)的降尺度方法，通过低分辨率数据生成高精度气象数据。定量与可视化分析表明GeoAN在多数指标上表现优异，并据此构建了1940年至今的日尺度历史气象数据集MDG625。该数据集解决了长时序高分辨率气象数据获取难题，为气候研究和相关领域提供了重要数据支撑。,2025-04-11,https://doi.org/10.5194/essd-17-1501-2025,https://doi.org/10.5194/essd-17-1501-2025,Unknown,"气象数据降尺度,历史气象重建,高分辨率数据生成,深度学习应用,长期气候数据集",气候科学,Earth System Science Data,"It is hard to access long-time series and high-resolution meteorological data for past years. In this paper, we propose the Geopotential-guided Attention Network (GeoAN) for downscaling which can produce high-resolution data using given low-resolution data. Quantitative and visual comparisons reveal our GeoAN produces better results with regard to most metrics. Using GeoAN, a historical meteorological dataset called MDG625 has been produced daily for the period since 1940."
